{
  "name": "Bipolar Risk Interview",
  "description": "Use when you need a structured, non-validated interview guide for bipolar risk factors and mood elevation history. Not a diagnostic or validated instrument.",
  "instructions": "# Bipolar Risk Interview (Non‑Validated)\n\n## Description\n\nThis is an **original, non‑validated** interview guide for exploring bipolar risk factors. It is **not diagnostic** and should not be used as a screening instrument.\n\n## Use Cases\n\n- When clinical history suggests possible bipolar spectrum features\n- When antidepressant response has been atypical or poor\n- When family history suggests bipolar disorder\n\n## Interactive Mode (Lightweight)\n\nUse this mode when the clinician asks to go step-by-step.\n\n1. Confirm this is a non-validated interview guide and check readiness.\n2. Ask one prompt at a time from the interview guide and wait for a response.\n3. Summarize key points and confirm accuracy before moving on.\n4. At the end, synthesize risk factors, red flags, and functional impact with suggested next steps.\n5. If safety concerns arise, pause and follow appropriate safety protocols.\n\n## Interview Guide\n\nSee: [assets/interview-guide.md](assets/interview-guide.md)\n\n## Safety Notes\n\nSee: [references/safety-notes.md](references/safety-notes.md)\n\n## Documentation\n\nSummarize history of mood elevation, sleep reduction, impulsivity, and functional impact.\n",
  "tags": [
    "bipolar",
    "risk",
    "interview",
    "non-validated",
    "workflow",
    "mental-health"
  ],
  "category": "clinical-workflow"
}
